1,Sardinha,Peixe pequeno e oleoso. Muito comum.
2,Churrasquinho,Combina carne com frutas. Cheira bem.
3,Madeira,Você poderia fazer quase qualquer coisa com isso.
4,Corda,Útil.
5,Peixe seco,"Salgado, pode ficar fresco por muito tempo."
6,Linho,Dá origem a uma fibra forte. Pode ser transformado em cordas.
7,Água,Água doce.
8,Coxa,Arrancada de uma gaivota. Cheia de sabor.
9,Pena,Penas macias. Eu me pergunto se poderia fazer um travesseiro com isso.
10,Sopa de peixe,Peixe cozido em água.
11,Carne estranha,Não sei dizer do que vem.
12,Osso,Osso duro. Útil para fazer itens afiados.
13,Arco,Pode atacar de uma posição segura.
14,Flecha,Uma vara fina com ponta afiada que pode causar danos menores.
15,Dentes de tubarão,Dentes de uma criatura mortal. Podem ser transformados em arma.
16,Batata,Bom para encher barrigas vazias.
17,Cenoura,Pode curar cegueira noturna.
18,Semente,Produz plantas aleatórias.
19,Musgo,Cresce em jangadas em dias úmidos. Pode ser transformado em tecido.
21,Tecido,Malha de fibra áspera.
22,Lança,Uma vara grossa e afiada. Arma básica.
23,Armadura de madeira,Protege o corpo. Meio pesado.
24,Capacete de madeira,Protege a cabeça. Meio pesado.
25,Barril,A superfície interna é impermeabilizada com verniz. Um recipiente à prova d'água.
26,Água do mar,Salgada. Não potável.
27,Limão,"Fresco, mas amargo e azedo. Assim como a vida."
28,Armadura de ossos,Protege o corpo. Faz cócegas.
29,Capacete de ossos,Protege a cabeça. Faz cócegas.
30,Armadura de linho,Protege o corpo. Fique longe do fogo.
31,Chapéu de linho,Protege a cabeça. Fique longe do fogo.
32,Trapos,Roupas simples.
33,Chapéu,Chapéu simples.
34,Adubo,Feito a partir de comida. Recurso importante para fazer um solo fértil.
35,Terra,Recolhida da lama da ilha. Recurso importante para fazer um solo fértil.
36,Peixe vermelho,"Tem uma cor estranha, mas um gosto bom."
37,Tintura,Use para tingir as construções.
38,Clava,"Pesado, mas tem chances de nocautear seu inimigo."
39,Papel,Feito da polpa.
40,Mapa,Registra locais e direções.
41,Polpa,Moa e cozinhe madeira para fazer polpa.
42,Verniz,Produzido quando se queima madeira. Pode ser usado como material impermeável.
43,Carvão,É madeira sem água.
44,Vara de pesca,Pescar acalma os nervos.
45,Tentáculo,Pego do tentáculo misterioso. Pode ser bom para negociação.
46,Espada de osso de peixe,"Afiada, bem leve."
47,Lança de osso,Lança feita de osso. Bem afiada.
48,Dardo,Jogue para causar muito dano.
49,Dardo de osso,Jogue para causar muito dano.
50,Flecha de osso,Mais afiada que a flecha de madeira.
51,Tábua de madeira,"Madeira bem cortada, usada para receitas avançadas."
52,Peça de madeira,Pedaço de madeira refinado. Usado para receitas mais complexas.
53,Tintura verde,"Pode tingir o chão, a parede e o teto de verde."
54,Tintura azul,"Pode tingir o chão, a parede e o teto de azul."
55,Tintura vermelha,"Pode tingir o chão, a parede e o teto de vermelho."
56,Tintura amarela,"Pode tingir o chão, a parede e o teto de amarelo."
57,Tintura branca,"Pode tingir o chão, a parede e o teto de branco."
58,Tintura preta,"Pode tingir o chão, a parede e o teto de preto."
60,Flauta,Tocar instrumentos acalma.
61,Zarabatana,Pode atirar dardos para causar dano.
62,Dardo de zarabatana,Use com uma zarabatana.
63,Fruta venenosa,Boa para fazer veneno.
64,Peixe perfumado,Pode ser usado para fazer incenso.
65,Incenso,Coloque em um incensário para meditar.
66,Caveira,Parece assustador.
67,Limonada,"Quando a vida te der um limão, faça uma limonada."
68,Fezes,Fedorento.
69,Carta náutica,Registra locais e direções.
70,Atum,Grande e gordo.
71,Pedra,Pode ser encontrada em ilhas.
72,Cinzas de madeira,Podem ser recolhidas de uma fogueira.
73,Erva básica,Ervas verdes.
74,Erva de sangue,Ervas vermelhas.
75,Erva azul,Ervas azuis.
76,Erva do Sol,Ervas amarelas.
77,Mistura de cura,Usado para curar feridas.
78,Mistura de energia,Usado para tirar o sono.
79,Mistura tranquilizante,Usado para recuperar a sanidade.
80,Bandagem,Usado para curar feridas.
81,Bandagem desinfectada,Usado para curar feridas. Diminui a chance de infecção.
82,Coco,Tem um pouco de água dentro.
83,Casca de coco,A casca de um coco.
84,Peixe assado,Crocante.
85,Purê de batata,Faz seu estômago ficar cheio.
86,Sopa de vegetais,Líquido saboroso feito de vegetais.
87,Caldo de carne,Líquido saboroso feito de pedaços de carne.
88,Bife de ervas,Bife suculento com ervas.
89,Enxada,Usada para lavrar.
90,Pesticida,Usado para desparasitação.
91,Peixe espada,Peixe com um nariz de espada.
92,Algas marinhas,Tem gosto de borracha.
93,Salmão,Gordo.
94,Polvo,Tem tinta por dentro.
95,Tinta,"Líquido escuro, bom para escrever."
96,Vieira,Boa proteína se você conseguir abrir.
97,Sopa de vieira,Líquido saboroso feito de vieira.
98,Pérola,Preciosa.
99,Sutiã de conchas,Parece uma sereia agora.
100,Capacete de coco,"Protege sua cabeça, mas vai obstruir a sua visão."
101,Modelo de navio em garrafa,Um pequeno modelo de navio colocado dentro de uma garrafa. Parece delicado.
102,Estatueta de madeira,Uma estatueta feita de madeira.
103,Anel de madeira,Um pequeno anel feito de madeira.
104,Peixe de madeira,Um pequeno peixe feito de madeira.
105,Coral,Colorido.
106,Moeda antiga,Uma velha moeda de ouro.
107,Semente de legume,Produz uma planta rizomatosa. Fornece energia e satisfação.
108,Semente de folha,Produz verduras aleatórias. Fornece vitamina para os sobreviventes.
109,Semente de fruta,Produz ervas aleatórias. Use para curar feridas.
110,Semente de flor,Produz bagas. Bom para sobremesas e tinturas.
111,Peixe venenoso,Peixe com veneno dentro. Não comestível.
112,Mirtilo,"Baga azul, gosto azedo."
113,Morango,"Baga vermelha, gosto doce."
114,Repolho,Vegetal de folhas verdes.
115,Spinacia,Vegetal de folhas verdes.
116,Barril furado,"Barril simples, vaza um pouco."
117,Salada,Fresca.
118,Mistura de frutas,Fresca.
119,Areia,Um material granulado.
120,Ampulheta,Usado para medir e calcular a velocidade de navegação.
121,Telescópio,Aumenta o alcance visual.
122,Couro,Bom para fazer roupas e armaduras.
123,Quartzo,Claro como cristal.
124,Restos de comida,Não tente comer isso.
125,Mistura de vegetais assados,Fresca.
126,Salada de vegetais,Fresca.
127,Mistura de sucos,Tem cheiro de fruta.
128,Fruta cozida,Doce e quente.
129,Churrasco,descriptions here...
130,Almôndega,Crocante.
131,Peixe assado,Crocante.
132,Sashimi,"É cru, mas gostoso."
133,Churrasquinho de frutas e vegetais,Crocante.
134,Salada de frutas,Fresca.
135,Churrasquinho de carne com vegetais,Crocante.
136,Salada de carnes,Fresca.
137,Churrasquinho de frutos do mar com vegetais,Crocante.
138,Salada de frutos do mar,Fresca.
139,Churrasquinho de fruta com carne,Crocante.
140,Ensopado de bife com frutas,Nutritivo.
141,Churrasquinho de frutos do mar com frutas,Crocante.
142,Ensopado de frutos do mar com frutas,Nutritivo.
143,Churrasquinho de frutos do mar com carne,Crocante.
144,Ensopado de frutos do mar com carne,Nutritivo.
145,Bife com geleia,Luxoso.
146,Filé de peixe com geleia,Luxoso.
147,Ensopado de carne luxuoso,Luxoso.
148,Ensopado de frutos do mar supremo,Luxoso.
149,Ovo,Botado por uma gaivota.
150,Sal,Faz a comida estragar mais devagar.
151,Cubo de sal,Faz a comida estragar mais devagar.
152,Carne seca de peixe,"Salgado, pode ficar fresco por muito tempo."
153,Vinho,Feito com frutas. É refrescante.
154,Cogumelo,Cresce em um tronco. É bonitinho.
155,Sangue,Sangue de uma criatura. Ótimo lanche para um vampiro.
156,Camarão,Camarõezinhos. Isca de pesca boa.
157,Picles,Vegetais salgados. Duram por muito tempo.
158,Água benta,Segurá-la ao orar dá sorte.
159,CarneDePássaroAssada,
160,Garrafa,
501,Braço direito humano,Um braço humano.
502,Braço esquerdo humano,Um braço humano.
503,Perna direita humana,Uma perna humana.
504,Perna esquerda humana,Uma perna humana.
505,Braço direito de madeira,Um braço artificial de madeira com um gancho.
506,Braço esquerdo de madeira,Um braço artificial de madeira com um gancho.
507,Perna direita de madeira,Uma perna artificial de madeira.
508,Perna esquerda de madeira,Uma perna artificial de madeira.
1000,Arco,Permite atacar de uma posição mais segura.
1001,Flecha,"Um galho fino e afiado, pode causar dano pequeno."
1002,Lança,Um galho grosso e afiado. Arma básica.
1003,Clava,"Pesado, mas tem chances de nocautear seu inimigo."
1004,Espada de osso de peixe,"Afiada, bem leve."
1005,Lança de osso,Lança feita de osso. Bem afiada.
1006,Lança de arremesso,Lance para causar muito dano.
1007,Lança de arremesso de osso,Lance para causar muito dano.
1008,Flecha de osso,Mais afiada do que a flecha de madeira.
1009,Zarabatana,Pode atirar dardos para causar dano.
1010,Dardo de zarabatana,Use com uma zarabatana.
1011,Bandagem,Usado para curar feridas.
1012,Bandagem desinfectada,Usado para curar feridas. Diminui a chance de infecção.
1013,Espada,Arma equilibrada.
1014,Adaga,É leve e pode causar hemorragia.
1015,Bumerangue,Pode voltar para você se tiver sorte.
1016,Estilingue,Não é de brinquedo. E não requer munição.
1017,Escudo,Pode bloquear a maioria dos projéteis.
1018,Claymore,"Pesada, só sobreviventes fortes conseguem usá-la corretamente."
1019,Martelo de guerra,"Pesado, pode atordoar um alvo facilmente."
1020,Clava com espetos,Clava com decorações letais.
1021,Machado de osso,"Ligeiro e afiado, bastante útil."
1022,Tridente de gelo,Um tridente que dispara gelo. É uma arma tecnológica.
1023,Tridente de fogo,Um tridente que cospe fogo. É uma arma tecnológica.
1024,Granada,
2001,Armadura de madeira,Protege o corpo. Meio pesada.
2002,Capacete de madeira,Protege a cabeça. Meio pesado.
2003,Armadura de ossos,Protege o corpo. Faz cócegas.
2004,Capacete de ossos,Protege a cabeça. Faz cócegas.
2005,Armadura de linho,Protege o corpo. Fique longe do fogo.
2006,Faixa de cabeça de linho,Protege o corpo. Fique longe do fogo.
2007,Trapos,Roupas simples.
2008,Faixa de cabeça,Faixa de cabeça simples.
2009,Sutiã de coco,Agora até parece uma sereia.
2010,CoCoNut Helmet,Protect your head. But will obstruct the view.
